harry@lamp-server:~$ sudo  tcpdump -n -i eth0
tcpdump: verbose output suppressed, use -v[v]... for full protocol decode
listening on eth0, link-type EN10MB (Ethernet), snapshot length 262144 bytes
20:28:40.328574 IP 10.1.0.4.22 > 72.255.0.160.6965: Flags [P.], seq 2394519207:2394519315, ack 3952231392, win 1251, length 108
20:28:40.328811 IP 10.1.0.4.22 > 72.255.0.160.6965: Flags [P.], seq 108:260, ack 1, win 1251, length 152
20:28:40.338538 IP 72.255.0.160.6965 > 10.1.0.4.22: Flags [.], ack 4294966888, win 8203, length 0
20:28:40.338538 IP 72.255.0.160.6965 > 10.1.0.4.22: Flags [P.], seq 1:37, ack 4294966888, win 8203, length 36
20:28:40.338625 IP 10.1.0.4.22 > 72.255.0.160.6965: Flags [P.], seq 260:296, ack 37, win 1251, length 36
20:28:40.370635 IP 72.255.0.160.6965 > 10.1.0.4.22: Flags [P.], seq 37:73, ack 4294966924, win 8203, length 36
20:28:40.370775 IP 10.1.0.4.22 > 72.255.0.160.6965: Flags [P.], seq 296:332, ack 73, win 1251, length 36
20:28:40.401366 IP 72.255.0.160.6965 > 10.1.0.4.22: Flags [P.], seq 73:109, ack 4294966960, win 8202, length 36
20:28:40.401571 IP 10.1.0.4.22 > 72.255.0.160.6965: Flags [P.], seq 332:368, ack 109, win 1251, length 36
20:28:40.424401 IP 72.255.0.160.6965 > 10.1.0.4.22: Flags [P.], seq 109:145, ack 4294966996, win 8202, length 36
20:28:40.424572 IP 10.1.0.4.22 > 72.255.0.160.6965: Flags [P.], seq 368:404, ack 145, win 1251, length 36
20:28:40.430610 IP 10.1.0.4.22 > 72.255.0.160.6965: Flags [P.], seq 404:1648, ack 145, win 1251, length 1244
20:28:40.446973 IP 72.255.0.160.6965 > 10.1.0.4.22: Flags [P.], seq 145:181, ack 4294967032, win 8202, length 36
20:28:40.447141 IP 10.1.0.4.22 > 72.255.0.160.6965: Flags [P.], seq 1648:1684, ack 181, win 1251, length 36
20:28:40.477438 IP 72.255.0.160.6965 > 10.1.0.4.22: Flags [P.], seq 181:217, ack 4294967068, win 8202, length 36
20:28:40.477615 IP 10.1.0.4.22 > 72.255.0.160.6965: Flags [P.], seq 1684:1720, ack 217, win 1251, length 36
20:28:40.509268 IP 72.255.0.160.6965 > 10.1.0.4.22: Flags [P.], seq 217:253, ack 4294967104, win 8202, length 36
20:28:40.509437 IP 10.1.0.4.22 > 72.255.0.160.6965: Flags [P.], seq 1720:1756, ack 253, win 1251, length 36
20:28:40.532232 IP 72.255.0.160.6965 > 10.1.0.4.22: Flags [.], ack 4294967216, win 8201, length 0
20:28:40.532232 IP 72.255.0.160.6965 > 10.1.0.4.22: Flags [P.], seq 253:289, ack 4294967216, win 8201, length 36
20:28:40.532398 IP 10.1.0.4.22 > 72.255.0.160.6965: Flags [P.], seq 1756:1792, ack 289, win 1251, length 36
20:28:40.532586 IP 72.255.0.160.6965 > 10.1.0.4.22: Flags [.], ack 4294967260, win 8207, length 0
20:28:40.534375 IP 10.1.0.4.22 > 72.255.0.160.6965: Flags [P.], seq 1792:2052, ack 289, win 1251, length 260
20:28:40.534591 IP 10.1.0.4.22 > 72.255.0.160.6965: Flags [P.], seq 2052:2744, ack 289, win 1251, length 692
20:28:40.534839 IP 10.1.0.4.22 > 72.255.0.160.6965: Flags [P.], seq 2744:3108, ack 289, win 1251, length 364
20:28:40.559189 IP 72.255.0.160.6965 > 10.1.0.4.22: Flags [P.], seq 289:325, ack 4294967260, win 8207, length 36
20:28:40.559331 IP 10.1.0.4.22 > 72.255.0.160.6965: Flags [P.], seq 3108:3144, ack 325, win 1251, length 36
20:28:40.580572 IP 72.255.0.160.6965 > 10.1.0.4.22: Flags [.], ack 260, win 8206, length 0
20:28:40.580881 IP 72.255.0.160.6965 > 10.1.0.4.22: Flags [P.], seq 325:361, ack 260, win 8206, length 36
20:28:40.580996 IP 10.1.0.4.22 > 72.255.0.160.6965: Flags [P.], seq 3144:3180, ack 361, win 1251, length 36
20:28:40.604989 IP 72.255.0.160.6965 > 10.1.0.4.22: Flags [P.], seq 361:397, ack 296, win 8205, length 36
20:28:40.605138 IP 10.1.0.4.22 > 72.255.0.160.6965: Flags [P.], seq 3180:3216, ack 397, win 1251, length 36
20:28:40.635293 IP 72.255.0.160.6965 > 10.1.0.4.22: Flags [P.], seq 397:433, ack 332, win 8205, length 36
20:28:40.635470 IP 10.1.0.4.22 > 72.255.0.160.6965: Flags [P.], seq 3216:3252, ack 433, win 1251, length 36
20:28:40.638513 IP 10.1.0.4.22 > 72.255.0.160.6965: Flags [P.], seq 3252:4584, ack 433, win 1251, length 1332
20:28:40.665624 IP 72.255.0.160.6965 > 10.1.0.4.22: Flags [P.], seq 433:469, ack 368, win 8205, length 36
20:28:40.665771 IP 10.1.0.4.22 > 72.255.0.160.6965: Flags [P.], seq 4584:4620, ack 469, win 1251, length 36
20:28:40.683050 IP 72.255.0.160.6965 > 10.1.0.4.22: Flags [.], ack 1648, win 8207, length 0
20:28:40.697433 IP 72.255.0.160.6965 > 10.1.0.4.22: Flags [P.], seq 469:505, ack 1648, win 8207, length 36
20:28:40.697576 IP 10.1.0.4.22 > 72.255.0.160.6965: Flags [P.], seq 4620:4656, ack 505, win 1251, length 36
20:28:40.727634 IP 72.255.0.160.6965 > 10.1.0.4.22: Flags [P.], seq 505:541, ack 1684, win 8207, length 36
20:28:40.727808 IP 10.1.0.4.22 > 72.255.0.160.6965: Flags [P.], seq 4656:4692, ack 541, win 1251, length 36
20:28:40.742476 IP 10.1.0.4.22 > 72.255.0.160.6965: Flags [P.], seq 4692:4944, ack 541, win 1251, length 252
20:28:40.742566 IP 10.1.0.4.22 > 72.255.0.160.6965: Flags [P.], seq 4944:5620, ack 541, win 1251, length 676
20:28:40.758647 IP 72.255.0.160.6965 > 10.1.0.4.22: Flags [P.], seq 541:577, ack 1720, win 8206, length 36
20:28:40.758879 IP 10.1.0.4.22 > 72.255.0.160.6965: Flags [P.], seq 5620:5656, ack 577, win 1251, length 36
20:28:40.784424 IP 72.255.0.160.6965 > 10.1.0.4.22: Flags [.], ack 1792, win 8206, length 0
20:28:40.784470 IP 72.255.0.160.6965 > 10.1.0.4.22: Flags [P.], seq 577:613, ack 1792, win 8206, length 36
20:28:40.784594 IP 10.1.0.4.22 > 72.255.0.160.6965: Flags [P.], seq 5656:5692, ack 613, win 1251, length 36
20:28:40.786420 IP 72.255.0.160.6965 > 10.1.0.4.22: Flags [.], ack 2744, win 8202, length 0
20:28:40.786677 IP 72.255.0.160.6965 > 10.1.0.4.22: Flags [.], ack 3108, win 8207, length 0
20:28:40.814054 IP 72.255.0.160.6965 > 10.1.0.4.22: Flags [.], ack 3144, win 8207, length 0
20:28:40.814054 IP 72.255.0.160.6965 > 10.1.0.4.22: Flags [P.], seq 613:649, ack 3144, win 8207, length 36
20:28:40.814217 IP 10.1.0.4.22 > 72.255.0.160.6965: Flags [P.], seq 5692:5728, ack 649, win 1251, length 36
20:28:40.833286 IP 72.255.0.160.6965 > 10.1.0.4.22: Flags [P.], seq 649:685, ack 3180, win 8206, length 36
20:28:40.833473 IP 10.1.0.4.22 > 72.255.0.160.6965: Flags [P.], seq 5728:5764, ack 685, win 1251, length 36
20:28:40.846548 IP 10.1.0.4.22 > 72.255.0.160.6965: Flags [P.], seq 5764:7264, ack 685, win 1251, length 1500
20:28:40.857404 IP 72.255.0.160.6965 > 10.1.0.4.22: Flags [P.], seq 685:721, ack 3216, win 8206, length 36
20:28:40.857560 IP 10.1.0.4.22 > 72.255.0.160.6965: Flags [P.], seq 7264:7300, ack 721, win 1251, length 36
20:28:40.881819 IP 72.255.0.160.6965 > 10.1.0.4.22: Flags [P.], seq 721:757, ack 3216, win 8206, length 36
20:28:40.881991 IP 10.1.0.4.22 > 72.255.0.160.6965: Flags [P.], seq 7300:7336, ack 757, win 1251, length 36
20:28:40.891175 IP 72.255.0.160.6965 > 10.1.0.4.22: Flags [.], ack 4584, win 8207, length 0
20:28:40.912628 IP 72.255.0.160.6965 > 10.1.0.4.22: Flags [P.], seq 757:793, ack 4584, win 8207, length 36
20:28:40.912777 IP 10.1.0.4.22 > 72.255.0.160.6965: Flags [P.], seq 7336:7372, ack 793, win 1251, length 36
20:28:40.947243 IP 72.255.0.160.6965 > 10.1.0.4.22: Flags [P.], seq 793:829, ack 4620, win 8207, length 36
20:28:40.947412 IP 10.1.0.4.22 > 72.255.0.160.6965: Flags [P.], seq 7372:7408, ack 829, win 1251, length 36
20:28:40.950384 IP 10.1.0.4.22 > 72.255.0.160.6965: Flags [P.], seq 7408:7660, ack 829, win 1251, length 252
20:28:40.950630 IP 10.1.0.4.22 > 72.255.0.160.6965: Flags [P.], seq 7660:8336, ack 829, win 1251, length 676
20:28:40.950785 IP 10.1.0.4.22 > 72.255.0.160.6965: Flags [P.], seq 8336:8596, ack 829, win 1251, length 260
20:28:40.975646 IP 72.255.0.160.6965 > 10.1.0.4.22: Flags [P.], seq 829:865, ack 4656, win 8206, length 36
20:28:40.975789 IP 10.1.0.4.22 > 72.255.0.160.6965: Flags [P.], seq 8596:8632, ack 865, win 1251, length 36
20:28:40.994309 IP 72.255.0.160.6965 > 10.1.0.4.22: Flags [.], ack 5620, win 8203, length 0
20:28:40.995725 IP 72.255.0.160.6965 > 10.1.0.4.22: Flags [P.], seq 865:901, ack 5620, win 8203, length 36
20:28:40.995848 IP 10.1.0.4.22 > 72.255.0.160.6965: Flags [P.], seq 8632:8668, ack 901, win 1251, length 36
20:28:41.021945 IP 72.255.0.160.6965 > 10.1.0.4.22: Flags [P.], seq 901:937, ack 5656, win 8203, length 36
20:28:41.022117 IP 10.1.0.4.22 > 72.255.0.160.6965: Flags [P.], seq 8668:8704, ack 937, win 1251, length 36
20:28:41.052637 IP 72.255.0.160.6965 > 10.1.0.4.22: Flags [P.], seq 937:973, ack 5692, win 8202, length 36
20:28:41.052852 IP 10.1.0.4.22 > 72.255.0.160.6965: Flags [P.], seq 8704:8740, ack 973, win 1251, length 36
20:28:41.054476 IP 10.1.0.4.22 > 72.255.0.160.6965: Flags [P.], seq 8740:10072, ack 973, win 1251, length 1332
20:28:41.083157 IP 72.255.0.160.6965 > 10.1.0.4.22: Flags [P.], seq 973:1009, ack 5728, win 8202, length 36
20:28:41.083332 IP 10.1.0.4.22 > 72.255.0.160.6965: Flags [P.], seq 10072:10108, ack 1009, win 1251, length 36
20:28:41.098395 IP 72.255.0.160.6965 > 10.1.0.4.22: Flags [.], ack 7264, win 8207, length 0
20:28:41.109120 IP 72.255.0.160.6965 > 10.1.0.4.22: Flags [.], ack 7300, win 8207, length 0
20:28:41.109147 IP 72.255.0.160.6965 > 10.1.0.4.22: Flags [P.], seq 1009:1045, ack 7300, win 8207, length 36
20:28:41.109262 IP 10.1.0.4.22 > 72.255.0.160.6965: Flags [P.], seq 10108:10144, ack 1045, win 1251, length 36
20:28:41.130088 IP 72.255.0.160.6965 > 10.1.0.4.22: Flags [P.], seq 1045:1081, ack 7300, win 8207, length 36
20:28:41.130197 IP 10.1.0.4.22 > 72.255.0.160.6965: Flags [P.], seq 10144:10180, ack 1081, win 1251, length 36
20:28:41.158518 IP 10.1.0.4.22 > 72.255.0.160.6965: Flags [P.], seq 10180:10440, ack 1081, win 1251, length 260
20:28:41.158734 IP 10.1.0.4.22 > 72.255.0.160.6965: Flags [P.], seq 10440:11220, ack 1081, win 1251, length 780
20:28:41.160338 IP 72.255.0.160.6965 > 10.1.0.4.22: Flags [P.], seq 1081:1117, ack 7336, win 8206, length 36
20:28:41.160413 IP 10.1.0.4.22 > 72.255.0.160.6965: Flags [P.], seq 11220:11256, ack 1117, win 1251, length 36
20:28:41.191461 IP 72.255.0.160.6965 > 10.1.0.4.22: Flags [P.], seq 1117:1153, ack 7372, win 8206, length 36
20:28:41.191650 IP 10.1.0.4.22 > 72.255.0.160.6965: Flags [P.], seq 11256:11292, ack 1153, win 1251, length 36
20:28:41.202624 IP 72.255.0.160.6965 > 10.1.0.4.22: Flags [.], ack 8336, win 8203, length 0
20:28:41.202624 IP 72.255.0.160.6965 > 10.1.0.4.22: Flags [.], ack 8596, win 8202, length 0
20:28:41.221971 IP 72.255.0.160.6965 > 10.1.0.4.22: Flags [P.], seq 1153:1189, ack 8596, win 8202, length 36
20:28:41.222133 IP 10.1.0.4.22 > 72.255.0.160.6965: Flags [P.], seq 11292:11328, ack 1189, win 1251, length 36
20:28:41.247861 IP 72.255.0.160.6965 > 10.1.0.4.22: Flags [.], ack 8668, win 8201, length 0
20:28:41.247861 IP 72.255.0.160.6965 > 10.1.0.4.22: Flags [P.], seq 1189:1225, ack 8668, win 8201, length 36
20:28:41.248011 IP 10.1.0.4.22 > 72.255.0.160.6965: Flags [P.], seq 11328:11364, ack 1225, win 1251, length 36
20:28:41.262542 IP 10.1.0.4.22 > 72.255.0.160.6965: Flags [P.], seq 11364:12792, ack 1225, win 1251, length 1428
20:28:41.273661 IP 72.255.0.160.6965 > 10.1.0.4.22: Flags [.], ack 8704, win 8207, length 0
20:28:41.274081 IP 72.255.0.160.6965 > 10.1.0.4.22: Flags [P.], seq 1225:1261, ack 8704, win 8207, length 36
20:28:41.274187 IP 10.1.0.4.22 > 72.255.0.160.6965: Flags [P.], seq 12792:12828, ack 1261, win 1251, length 36
20:28:41.307665 IP 72.255.0.160.6965 > 10.1.0.4.22: Flags [.], ack 10072, win 8201, length 0
20:28:41.307711 IP 72.255.0.160.6965 > 10.1.0.4.22: Flags [P.], seq 1261:1297, ack 10072, win 8201, length 36
20:28:41.307840 IP 10.1.0.4.22 > 72.255.0.160.6965: Flags [P.], seq 12828:12864, ack 1297, win 1251, length 36
20:28:41.335269 IP 72.255.0.160.6965 > 10.1.0.4.22: Flags [P.], seq 1297:1333, ack 10108, win 8201, length 36
20:28:41.335415 IP 10.1.0.4.22 > 72.255.0.160.6965: Flags [P.], seq 12864:12900, ack 1333, win 1251, length 36
20:28:41.360989 IP 72.255.0.160.6965 > 10.1.0.4.22: Flags [.], ack 10144, win 8207, length 0
20:28:41.360989 IP 72.255.0.160.6965 > 10.1.0.4.22: Flags [P.], seq 1333:1369, ack 10144, win 8207, length 36
20:28:41.361158 IP 10.1.0.4.22 > 72.255.0.160.6965: Flags [P.], seq 12900:12936, ack 1369, win 1251, length 36
20:28:41.366393 IP 10.1.0.4.22 > 72.255.0.160.6965: Flags [P.], seq 12936:13180, ack 1369, win 1251, length 244
20:28:41.366635 IP 10.1.0.4.22 > 72.255.0.160.6965: Flags [P.], seq 13180:13976, ack 1369, win 1251, length 796
20:28:41.367052 IP 10.1.0.4.22 > 72.255.0.160.6965: Flags [P.], seq 13976:14332, ack 1369, win 1251, length 356
20:28:41.382404 IP 72.255.0.160.6965 > 10.1.0.4.22: Flags [P.], seq 1369:1405, ack 10180, win 8207, length 36
20:28:41.382569 IP 10.1.0.4.22 > 72.255.0.160.6965: Flags [P.], seq 14332:14368, ack 1405, win 1251, length 36
20:28:41.410952 IP 72.255.0.160.6965 > 10.1.0.4.22: Flags [.], ack 11220, win 8203, length 0
20:28:41.410952 IP 72.255.0.160.6965 > 10.1.0.4.22: Flags [P.], seq 1405:1441, ack 11220, win 8203, length 36
20:28:41.411127 IP 10.1.0.4.22 > 72.255.0.160.6965: Flags [P.], seq 14368:14404, ack 1441, win 1251, length 36
20:28:41.443280 IP 72.255.0.160.6965 > 10.1.0.4.22: Flags [.], ack 11292, win 8202, length 0
20:28:41.443456 IP 72.255.0.160.6965 > 10.1.0.4.22: Flags [P.], seq 1441:1477, ack 11292, win 8202, length 36
20:28:41.443574 IP 10.1.0.4.22 > 72.255.0.160.6965: Flags [P.], seq 14404:14440, ack 1477, win 1251, length 36
20:28:41.470500 IP 10.1.0.4.22 > 72.255.0.160.6965: Flags [P.], seq 14440:15676, ack 1477, win 1251, length 1236
20:28:41.474368 IP 72.255.0.160.6965 > 10.1.0.4.22: Flags [P.], seq 1477:1513, ack 11328, win 8202, length 36
20:28:41.474467 IP 10.1.0.4.22 > 72.255.0.160.6965: Flags [P.], seq 15676:15712, ack 1513, win 1251, length 36
20:28:41.499937 IP 72.255.0.160.6965 > 10.1.0.4.22: Flags [P.], seq 1513:1549, ack 11364, win 8202, length 36
20:28:41.500153 IP 10.1.0.4.22 > 72.255.0.160.6965: Flags [P.], seq 15712:15748, ack 1549, win 1251, length 36
20:28:41.514690 IP 72.255.0.160.6965 > 10.1.0.4.22: Flags [.], ack 12792, win 8207, length 0
20:28:41.526239 IP 72.255.0.160.6965 > 10.1.0.4.22: Flags [P.], seq 1549:1585, ack 12828, win 8207, length 36
20:28:41.526369 IP 10.1.0.4.22 > 72.255.0.160.6965: Flags [P.], seq 15748:15784, ack 1585, win 1251, length 36
20:28:41.559878 IP 72.255.0.160.6965 > 10.1.0.4.22: Flags [P.], seq 1585:1621, ack 12864, win 8206, length 36
20:28:41.559987 IP 10.1.0.4.22 > 72.255.0.160.6965: Flags [P.], seq 15784:15820, ack 1621, win 1251, length 36
20:28:41.574564 IP 10.1.0.4.22 > 72.255.0.160.6965: Flags [P.], seq 15820:16080, ack 1621, win 1251, length 260
20:28:41.574865 IP 10.1.0.4.22 > 72.255.0.160.6965: Flags [P.], seq 16080:16996, ack 1621, win 1251, length 916
20:28:41.587287 IP 72.255.0.160.6965 > 10.1.0.4.22: Flags [P.], seq 1621:1657, ack 12900, win 8206, length 36
20:28:41.587402 IP 10.1.0.4.22 > 72.255.0.160.6965: Flags [P.], seq 16996:17032, ack 1657, win 1251, length 36
20:28:41.613654 IP 72.255.0.160.6965 > 10.1.0.4.22: Flags [P.], seq 1657:1693, ack 12936, win 8206, length 36
20:28:41.613867 IP 10.1.0.4.22 > 72.255.0.160.6965: Flags [P.], seq 17032:17068, ack 1693, win 1251, length 36
20:28:41.618426 IP 72.255.0.160.6965 > 10.1.0.4.22: Flags [.], ack 13976, win 8202, length 0
20:28:41.618461 IP 72.255.0.160.6965 > 10.1.0.4.22: Flags [.], ack 14332, win 8207, length 0
20:28:41.634787 IP 72.255.0.160.6965 > 10.1.0.4.22: Flags [.], ack 14368, win 8207, length 0
20:28:41.634787 IP 72.255.0.160.6965 > 10.1.0.4.22: Flags [P.], seq 1693:1765, ack 14368, win 8207, length 72
20:28:41.634943 IP 10.1.0.4.22 > 72.255.0.160.6965: Flags [P.], seq 17068:17104, ack 1765, win 1251, length 36
20:28:41.663395 IP 72.255.0.160.6965 > 10.1.0.4.22: Flags [P.], seq 1765:1801, ack 14404, win 8206, length 36
20:28:41.663534 IP 10.1.0.4.22 > 72.255.0.160.6965: Flags [P.], seq 17104:17140, ack 1801, win 1251, length 36
20:28:41.678578 IP 10.1.0.4.22 > 72.255.0.160.6965: Flags [P.], seq 17140:18576, ack 1801, win 1251, length 1436
20:28:41.695680 IP 72.255.0.160.6965 > 10.1.0.4.22: Flags [P.], seq 1801:1837, ack 14440, win 8206, length 36
20:28:41.695830 IP 10.1.0.4.22 > 72.255.0.160.6965: Flags [P.], seq 18576:18612, ack 1837, win 1251, length 36
20:28:41.723260 IP 72.255.0.160.6965 > 10.1.0.4.22: Flags [P.], seq 1837:1873, ack 15676, win 8202, length 36
20:28:41.723415 IP 10.1.0.4.22 > 72.255.0.160.6965: Flags [P.], seq 18612:18648, ack 1873, win 1251, length 36
20:28:41.751858 IP 72.255.0.160.6965 > 10.1.0.4.22: Flags [.], ack 15748, win 8207, length 0
20:28:41.752087 IP 72.255.0.160.6965 > 10.1.0.4.22: Flags [P.], seq 1873:1909, ack 15748, win 8207, length 36
20:28:41.752279 IP 10.1.0.4.22 > 72.255.0.160.6965: Flags [P.], seq 18648:18684, ack 1909, win 1251, length 36
20:28:41.778280 IP 72.255.0.160.6965 > 10.1.0.4.22: Flags [P.], seq 1909:1945, ack 15784, win 8207, length 36
20:28:41.778442 IP 10.1.0.4.22 > 72.255.0.160.6965: Flags [P.], seq 18684:18720, ack 1945, win 1251, length 36
20:28:41.782431 IP 10.1.0.4.22 > 72.255.0.160.6965: Flags [P.], seq 18720:18980, ack 1945, win 1251, length 260
20:28:41.782777 IP 10.1.0.4.22 > 72.255.0.160.6965: Flags [P.], seq 18980:19672, ack 1945, win 1251, length 692
20:28:41.783254 IP 10.1.0.4.22 > 72.255.0.160.6965: Flags [P.], seq 19672:20004, ack 1945, win 1251, length 332
20:28:41.809129 IP 72.255.0.160.6965 > 10.1.0.4.22: Flags [P.], seq 1945:1981, ack 15784, win 8207, length 36
20:28:41.809278 IP 10.1.0.4.22 > 72.255.0.160.6965: Flags [P.], seq 20004:20040, ack 1981, win 1251, length 36
20:28:41.826683 IP 72.255.0.160.6965 > 10.1.0.4.22: Flags [.], ack 16996, win 8202, length 0
20:28:41.839222 IP 72.255.0.160.6965 > 10.1.0.4.22: Flags [.], ack 17032, win 8202, length 0
20:28:41.839222 IP 72.255.0.160.6965 > 10.1.0.4.22: Flags [P.], seq 1981:2017, ack 17032, win 8202, length 36
20:28:41.839426 IP 10.1.0.4.22 > 72.255.0.160.6965: Flags [P.], seq 20040:20076, ack 2017, win 1251, length 36
20:28:41.866451 IP 72.255.0.160.6965 > 10.1.0.4.22: Flags [P.], seq 2017:2053, ack 17068, win 8202, length 36
20:28:41.866602 IP 10.1.0.4.22 > 72.255.0.160.6965: Flags [P.], seq 20076:20112, ack 2053, win 1251, length 36
20:28:41.886531 IP 10.1.0.4.22 > 72.255.0.160.6965: Flags [P.], seq 20112:21348, ack 2053, win 1251, length 1236
20:28:41.886996 IP 72.255.0.160.6965 > 10.1.0.4.22: Flags [P.], seq 2053:2089, ack 17104, win 8201, length 36
20:28:41.887108 IP 10.1.0.4.22 > 72.255.0.160.6965: Flags [P.], seq 21348:21384, ack 2089, win 1251, length 36
20:28:41.915910 IP 72.255.0.160.6965 > 10.1.0.4.22: Flags [P.], seq 2089:2125, ack 17140, win 8201, length 36
20:28:41.916112 IP 10.1.0.4.22 > 72.255.0.160.6965: Flags [P.], seq 21384:21420, ack 2125, win 1251, length 36
20:28:41.930566 IP 72.255.0.160.6965 > 10.1.0.4.22: Flags [.], ack 18576, win 8207, length 0
20:28:41.948375 IP 72.255.0.160.6965 > 10.1.0.4.22: Flags [P.], seq 2125:2161, ack 18612, win 8207, length 36
20:28:41.948543 IP 10.1.0.4.22 > 72.255.0.160.6965: Flags [P.], seq 21420:21456, ack 2161, win 1251, length 36
20:28:41.975545 IP 72.255.0.160.6965 > 10.1.0.4.22: Flags [P.], seq 2161:2197, ack 18648, win 8206, length 36
20:28:41.975691 IP 10.1.0.4.22 > 72.255.0.160.6965: Flags [P.], seq 21456:21492, ack 2197, win 1251, length 36
20:28:41.990407 IP 10.1.0.4.22 > 72.255.0.160.6965: Flags [P.], seq 21492:21752, ack 2197, win 1251, length 260
20:28:41.990694 IP 10.1.0.4.22 > 72.255.0.160.6965: Flags [P.], seq 21752:22668, ack 2197, win 1251, length 916
20:28:42.004619 IP 72.255.0.160.6965 > 10.1.0.4.22: Flags [P.], seq 2197:2233, ack 18684, win 8206, length 36
20:28:42.004799 IP 10.1.0.4.22 > 72.255.0.160.6965: Flags [P.], seq 22668:22704, ack 2233, win 1251, length 36
20:28:42.030142 IP 72.255.0.160.6965 > 10.1.0.4.22: Flags [P.], seq 2233:2269, ack 18720, win 8206, length 36
20:28:42.030313 IP 10.1.0.4.22 > 72.255.0.160.6965: Flags [P.], seq 22704:22740, ack 2269, win 1251, length 36
20:28:42.034650 IP 72.255.0.160.6965 > 10.1.0.4.22: Flags [.], ack 19672, win 8202, length 0
20:28:42.034724 IP 72.255.0.160.6965 > 10.1.0.4.22: Flags [.], ack 20004, win 8207, length 0
20:28:42.058985 IP 72.255.0.160.6965 > 10.1.0.4.22: Flags [P.], seq 2269:2305, ack 20004, win 8207, length 36
20:28:42.059159 IP 10.1.0.4.22 > 72.255.0.160.6965: Flags [P.], seq 22740:22776, ack 2305, win 1251, length 36
20:28:42.090396 IP 72.255.0.160.6965 > 10.1.0.4.22: Flags [P.], seq 2305:2341, ack 20040, win 8207, length 36
20:28:42.090548 IP 10.1.0.4.22 > 72.255.0.160.6965: Flags [P.], seq 22776:22812, ack 2341, win 1251, length 36
20:28:42.094493 IP 10.1.0.4.22 > 72.255.0.160.6965: Flags [P.], seq 22812:24152, ack 2341, win 1251, length 1340
20:28:42.118509 IP 72.255.0.160.6965 > 10.1.0.4.22: Flags [.], ack 20112, win 8206, length 0
20:28:42.120433 IP 72.255.0.160.6965 > 10.1.0.4.22: Flags [P.], seq 2341:2377, ack 20112, win 8206, length 36
20:28:42.120571 IP 10.1.0.4.22 > 72.255.0.160.6965: Flags [P.], seq 24152:24188, ack 2377, win 1251, length 36
20:28:42.138943 IP 72.255.0.160.6965 > 10.1.0.4.22: Flags [P.], seq 2377:2413, ack 21348, win 8202, length 36
20:28:42.139119 IP 10.1.0.4.22 > 72.255.0.160.6965: Flags [P.], seq 24188:24224, ack 2413, win 1251, length 36
20:28:42.166794 IP 72.255.0.160.6965 > 10.1.0.4.22: Flags [P.], seq 2413:2449, ack 21384, win 8201, length 36
20:28:42.166960 IP 10.1.0.4.22 > 72.255.0.160.6965: Flags [P.], seq 24224:24260, ack 2449, win 1251, length 36
20:28:42.168620 IP 72.255.0.160.6965 > 10.1.0.4.22: Flags [.], ack 21420, win 8207, length 0
20:28:42.198213 IP 72.255.0.160.6965 > 10.1.0.4.22: Flags [P.], seq 2449:2485, ack 21420, win 8207, length 36
20:28:42.198390 IP 10.1.0.4.22 > 72.255.0.160.6965: Flags [P.], seq 24260:24296, ack 2485, win 1251, length 36
20:28:42.198709 IP 10.1.0.4.22 > 72.255.0.160.6965: Flags [P.], seq 24296:25308, ack 2485, win 1251, length 1012
20:28:42.228117 IP 72.255.0.160.6965 > 10.1.0.4.22: Flags [.], ack 21492, win 8206, length 0
20:28:42.228117 IP 72.255.0.160.6965 > 10.1.0.4.22: Flags [P.], seq 2485:2521, ack 21492, win 8206, length 36
20:28:42.228283 IP 10.1.0.4.22 > 72.255.0.160.6965: Flags [P.], seq 25308:25344, ack 2521, win 1251, length 36
20:28:42.243025 IP 72.255.0.160.6965 > 10.1.0.4.22: Flags [.], ack 22668, win 8202, length 0
20:28:42.256671 IP 72.255.0.160.6965 > 10.1.0.4.22: Flags [P.], seq 2521:2557, ack 22704, win 8202, length 36
20:28:42.256830 IP 10.1.0.4.22 > 72.255.0.160.6965: Flags [P.], seq 25344:25380, ack 2557, win 1251, length 36
20:28:42.282299 IP 72.255.0.160.6965 > 10.1.0.4.22: Flags [P.], seq 2557:2593, ack 22740, win 8202, length 36
20:28:42.282455 IP 10.1.0.4.22 > 72.255.0.160.6965: Flags [P.], seq 25380:25416, ack 2593, win 1251, length 36
20:28:42.302739 IP 10.1.0.4.22 > 72.255.0.160.6965: Flags [P.], seq 25416:26644, ack 2593, win 1251, length 1228
20:28:42.306713 IP 72.255.0.160.6965 > 10.1.0.4.22: Flags [P.], seq 2593:2629, ack 22740, win 8202, length 36
20:28:42.306858 IP 10.1.0.4.22 > 72.255.0.160.6965: Flags [P.], seq 26644:26680, ack 2629, win 1251, length 36
20:28:42.337440 IP 72.255.0.160.6965 > 10.1.0.4.22: Flags [P.], seq 2629:2665, ack 22776, win 8201, length 36
20:28:42.337611 IP 10.1.0.4.22 > 72.255.0.160.6965: Flags [P.], seq 26680:26716, ack 2665, win 1251, length 36
20:28:42.346673 IP 72.255.0.160.6965 > 10.1.0.4.22: Flags [.], ack 24152, win 8207, length 0
20:28:42.369126 IP 72.255.0.160.6965 > 10.1.0.4.22: Flags [P.], seq 2665:2701, ack 24152, win 8207, length 36
20:28:42.369266 IP 10.1.0.4.22 > 72.255.0.160.6965: Flags [P.], seq 26716:26752, ack 2701, win 1251, length 36
20:28:42.391320 IP 72.255.0.160.6965 > 10.1.0.4.22: Flags [.], ack 24224, win 8206, length 0
20:28:42.391471 IP 72.255.0.160.6965 > 10.1.0.4.22: Flags [P.], seq 2701:2737, ack 24224, win 8206, length 36
20:28:42.391592 IP 10.1.0.4.22 > 72.255.0.160.6965: Flags [P.], seq 26752:26788, ack 2737, win 1251, length 36
20:28:42.406429 IP 10.1.0.4.22 > 72.255.0.160.6965: Flags [P.], seq 26788:27048, ack 2737, win 1251, length 260
20:28:42.406726 IP 10.1.0.4.22 > 72.255.0.160.6965: Flags [P.], seq 27048:28060, ack 2737, win 1251, length 1012
20:28:42.414880 IP 72.255.0.160.6965 > 10.1.0.4.22: Flags [P.], seq 2737:2773, ack 24224, win 8206, length 36
20:28:42.414989 IP 10.1.0.4.22 > 72.255.0.160.6965: Flags [P.], seq 28060:28096, ack 2773, win 1251, length 36
20:28:42.446201 IP 72.255.0.160.6965 > 10.1.0.4.22: Flags [P.], seq 2773:2809, ack 24260, win 8206, length 36
20:28:42.446425 IP 10.1.0.4.22 > 72.255.0.160.6965: Flags [P.], seq 28096:28132, ack 2809, win 1251, length 36
20:28:42.450771 IP 72.255.0.160.6965 > 10.1.0.4.22: Flags [.], ack 25308, win 8202, length 0
20:28:42.475913 IP 72.255.0.160.6965 > 10.1.0.4.22: Flags [P.], seq 2809:2845, ack 25308, win 8202, length 36
20:28:42.476099 IP 10.1.0.4.22 > 72.255.0.160.6965: Flags [P.], seq 28132:28168, ack 2845, win 1251, length 36
20:28:42.507131 IP 72.255.0.160.6965 > 10.1.0.4.22: Flags [P.], seq 2845:2881, ack 25344, win 8202, length 36
20:28:42.507296 IP 10.1.0.4.22 > 72.255.0.160.6965: Flags [P.], seq 28168:28204, ack 2881, win 1251, length 36
20:28:42.510439 IP 10.1.0.4.22 > 72.255.0.160.6965: Flags [P.], seq 28204:29456, ack 2881, win 1251, length 1252
20:28:42.534612 IP 72.255.0.160.6965 > 10.1.0.4.22: Flags [.], ack 25416, win 8202, length 0
20:28:42.534612 IP 72.255.0.160.6965 > 10.1.0.4.22: Flags [P.], seq 2881:2917, ack 25416, win 8202, length 36
20:28:42.534773 IP 10.1.0.4.22 > 72.255.0.160.6965: Flags [P.], seq 29456:29492, ack 2917, win 1251, length 36
20:28:42.554704 IP 72.255.0.160.6965 > 10.1.0.4.22: Flags [.], ack 26644, win 8207, length 0
20:28:42.556685 IP 72.255.0.160.6965 > 10.1.0.4.22: Flags [P.], seq 2917:2953, ack 26644, win 8207, length 36
20:28:42.556879 IP 10.1.0.4.22 > 72.255.0.160.6965: Flags [P.], seq 29492:29528, ack 2953, win 1251, length 36
20:28:42.584627 IP 72.255.0.160.6965 > 10.1.0.4.22: Flags [P.], seq 2953:2989, ack 26680, win 8207, length 36
20:28:42.584780 IP 10.1.0.4.22 > 72.255.0.160.6965: Flags [P.], seq 29528:29564, ack 2989, win 1251, length 36
20:28:42.614520 IP 10.1.0.4.22 > 72.255.0.160.6965: Flags [P.], seq 29564:29808, ack 2989, win 1251, length 244
20:28:42.614747 IP 10.1.0.4.22 > 72.255.0.160.6965: Flags [P.], seq 29808:30612, ack 2989, win 1251, length 804
20:28:42.615029 IP 72.255.0.160.6965 > 10.1.0.4.22: Flags [P.], seq 2989:3025, ack 26716, win 8206, length 36
20:28:42.615114 IP 10.1.0.4.22 > 72.255.0.160.6965: Flags [P.], seq 30612:30648, ack 3025, win 1251, length 36
20:28:42.643630 IP 72.255.0.160.6965 > 10.1.0.4.22: Flags [.], ack 26788, win 8206, length 0
20:28:42.659030 IP 72.255.0.160.6965 > 10.1.0.4.22: Flags [.], ack 28060, win 8207, length 0
20:28:42.698401 IP 72.255.0.160.6965 > 10.1.0.4.22: Flags [.], ack 28132, win 8206, length 0
20:28:42.718480 IP 10.1.0.4.22 > 72.255.0.160.6965: Flags [P.], seq 30648:31420, ack 3025, win 1251, length 772
20:28:42.760100 IP 72.255.0.160.6965 > 10.1.0.4.22: Flags [.], ack 28204, win 8206, length 0
20:28:42.786628 IP 72.255.0.160.6965 > 10.1.0.4.22: Flags [.], ack 29492, win 8207, length 0
20:28:42.822474 IP 10.1.0.4.22 > 72.255.0.160.6965: Flags [P.], seq 31420:31664, ack 3025, win 1251, length 244
20:28:42.822817 IP 10.1.0.4.22 > 72.255.0.160.6965: Flags [P.], seq 31664:31796, ack 3025, win 1251, length 132
20:28:42.837042 IP 72.255.0.160.6965 > 10.1.0.4.22: Flags [.], ack 29564, win 8206, length 0
20:28:42.866754 IP 72.255.0.160.6965 > 10.1.0.4.22: Flags [.], ack 30612, win 8202, length 0
20:28:42.908204 IP 72.255.0.160.6965 > 10.1.0.4.22: Flags [.], ack 30648, win 8202, length 0
20:28:42.926422 IP 10.1.0.4.22 > 72.255.0.160.6965: Flags [P.], seq 31796:32344, ack 3025, win 1251, length 548
20:28:43.017447 IP 72.255.0.160.6965 > 10.1.0.4.22: Flags [.], ack 31420, win 8207, length 0
20:28:43.030391 IP 10.1.0.4.22 > 72.255.0.160.6965: Flags [P.], seq 32344:32588, ack 3025, win 1251, length 244
20:28:43.030861 IP 10.1.0.4.22 > 72.255.0.160.6965: Flags [P.], seq 32588:32624, ack 3025, win 1251, length 36
20:28:43.075219 IP 72.255.0.160.6965 > 10.1.0.4.22: Flags [.], ack 31796, win 8205, length 0
20:28:43.134429 IP 10.1.0.4.22 > 72.255.0.160.6965: Flags [P.], seq 32624:32980, ack 3025, win 1251, length 356
20:28:43.233527 IP 72.255.0.160.6965 > 10.1.0.4.22: Flags [.], ack 32344, win 8203, length 0
20:28:43.238410 IP 10.1.0.4.22 > 72.255.0.160.6965: Flags [P.], seq 32980:33224, ack 3025, win 1251, length 244
20:28:43.238638 IP 10.1.0.4.22 > 72.255.0.160.6965: Flags [P.], seq 33224:33260, ack 3025, win 1251, length 36
20:28:43.282944 IP 72.255.0.160.6965 > 10.1.0.4.22: Flags [.], ack 32624, win 8202, length 0
20:28:43.342346 IP 10.1.0.4.22 > 72.255.0.160.6965: Flags [P.], seq 33260:33408, ack 3025, win 1251, length 148
20:28:43.342511 IP 10.1.0.4.22 > 72.255.0.160.6965: Flags [P.], seq 33408:33652, ack 3025, win 1251, length 244
20:28:43.433683 IP 72.255.0.160.6965 > 10.1.0.4.22: Flags [.], ack 32980, win 8207, length 0
20:28:43.446383 IP 10.1.0.4.22 > 72.255.0.160.6965: Flags [P.], seq 33652:34008, ack 3025, win 1251, length 356
20:28:43.490681 IP 72.255.0.160.6965 > 10.1.0.4.22: Flags [.], ack 33260, win 8206, length 0
20:28:43.550384 IP 10.1.0.4.22 > 72.255.0.160.6965: Flags [P.], seq 34008:34252, ack 3025, win 1251, length 244
20:28:43.594781 IP 72.255.0.160.6965 > 10.1.0.4.22: Flags [.], ack 33652, win 8204, length 0
20:28:43.654442 IP 10.1.0.4.22 > 72.255.0.160.6965: Flags [P.], seq 34252:34496, ack 3025, win 1251, length 244
20:28:43.743074 IP 72.255.0.160.6965 > 10.1.0.4.22: Flags [.], ack 34008, win 8203, length 0
20:28:43.758386 IP 10.1.0.4.22 > 72.255.0.160.6965: Flags [P.], seq 34496:34740, ack 3025, win 1251, length 244
20:28:43.851411 IP 72.255.0.160.6965 > 10.1.0.4.22: Flags [.], ack 34252, win 8202, length 0
20:28:43.862402 IP 10.1.0.4.22 > 72.255.0.160.6965: Flags [P.], seq 34740:34984, ack 3025, win 1251, length 244
20:28:43.959651 IP 72.255.0.160.6965 > 10.1.0.4.22: Flags [.], ack 34496, win 8207, length 0
20:28:43.966433 IP 10.1.0.4.22 > 72.255.0.160.6965: Flags [P.], seq 34984:35228, ack 3025, win 1251, length 244
20:28:44.052048 IP 72.255.0.160.6965 > 10.1.0.4.22: Flags [.], ack 34740, win 8206, length 0
20:28:44.070385 IP 10.1.0.4.22 > 72.255.0.160.6965: Flags [P.], seq 35228:35472, ack 3025, win 1251, length 244
20:28:44.158114 IP 72.255.0.160.6965 > 10.1.0.4.22: Flags [.], ack 34984, win 8205, length 0
20:28:44.174430 IP 10.1.0.4.22 > 72.255.0.160.6965: Flags [P.], seq 35472:35716, ack 3025, win 1251, length 244
20:28:44.265523 IP 72.255.0.160.6965 > 10.1.0.4.22: Flags [.], ack 35228, win 8204, length 0
20:28:44.278410 IP 10.1.0.4.22 > 72.255.0.160.6965: Flags [P.], seq 35716:35960, ack 3025, win 1251, length 244
20:28:44.374277 IP 72.255.0.160.6965 > 10.1.0.4.22: Flags [.], ack 35472, win 8203, length 0
20:28:44.382394 IP 10.1.0.4.22 > 72.255.0.160.6965: Flags [P.], seq 35960:36204, ack 3025, win 1251, length 244
20:28:44.466044 IP 72.255.0.160.6965 > 10.1.0.4.22: Flags [.], ack 35716, win 8202, length 0
20:28:44.486413 IP 10.1.0.4.22 > 72.255.0.160.6965: Flags [P.], seq 36204:36448, ack 3025, win 1251, length 244
20:28:44.576024 IP 72.255.0.160.6965 > 10.1.0.4.22: Flags [.], ack 35960, win 8207, length 0
20:28:44.590416 IP 10.1.0.4.22 > 72.255.0.160.6965: Flags [P.], seq 36448:36692, ack 3025, win 1251, length 244
20:28:44.683649 IP 72.255.0.160.6965 > 10.1.0.4.22: Flags [.], ack 36204, win 8206, length 0
20:28:44.694485 IP 10.1.0.4.22 > 72.255.0.160.6965: Flags [P.], seq 36692:36936, ack 3025, win 1251, length 244
20:28:44.792163 IP 72.255.0.160.6965 > 10.1.0.4.22: Flags [.], ack 36448, win 8205, length 0
20:28:44.798430 IP 10.1.0.4.22 > 72.255.0.160.6965: Flags [P.], seq 36936:37180, ack 3025, win 1251, length 244
20:28:44.886276 IP 72.255.0.160.6965 > 10.1.0.4.22: Flags [.], ack 36692, win 8204, length 0
20:28:44.902416 IP 10.1.0.4.22 > 72.255.0.160.6965: Flags [P.], seq 37180:37424, ack 3025, win 1251, length 244
20:28:44.994942 IP 72.255.0.160.6965 > 10.1.0.4.22: Flags [.], ack 36936, win 8203, length 0
20:28:45.006396 IP 10.1.0.4.22 > 72.255.0.160.6965: Flags [P.], seq 37424:37668, ack 3025, win 1251, length 244
20:28:45.103640 IP 72.255.0.160.6965 > 10.1.0.4.22: Flags [.], ack 37180, win 8202, length 0
20:28:45.110455 IP 10.1.0.4.22 > 72.255.0.160.6965: Flags [P.], seq 37668:37912, ack 3025, win 1251, length 244
20:28:45.110914 IP 10.1.0.4.22 > 72.255.0.160.6965: Flags [P.], seq 37912:37948, ack 3025, win 1251, length 36
20:28:45.195652 IP 72.255.0.160.6965 > 10.1.0.4.22: Flags [.], ack 37424, win 8207, length 0
20:28:45.214416 IP 10.1.0.4.22 > 72.255.0.160.6965: Flags [P.], seq 37948:38304, ack 3025, win 1251, length 356
20:28:45.303588 IP 72.255.0.160.6965 > 10.1.0.4.22: Flags [.], ack 37668, win 8206, length 0
20:28:45.318421 IP 10.1.0.4.22 > 72.255.0.160.6965: Flags [P.], seq 38304:38548, ack 3025, win 1251, length 244
20:28:45.362980 IP 72.255.0.160.6965 > 10.1.0.4.22: Flags [.], ack 37948, win 8205, length 0
20:28:45.422440 IP 10.1.0.4.22 > 72.255.0.160.6965: Flags [P.], seq 38548:38792, ack 3025, win 1251, length 244
20:28:45.520915 IP 72.255.0.160.6965 > 10.1.0.4.22: Flags [.], ack 38304, win 8203, length 0
20:28:45.526381 IP 10.1.0.4.22 > 72.255.0.160.6965: Flags [P.], seq 38792:39036, ack 3025, win 1251, length 244
20:28:45.613537 IP 72.255.0.160.6965 > 10.1.0.4.22: Flags [.], ack 38548, win 8202, length 0
20:28:45.630394 IP 10.1.0.4.22 > 72.255.0.160.6965: Flags [P.], seq 39036:39280, ack 3025, win 1251, length 244
20:28:45.721288 IP 72.255.0.160.6965 > 10.1.0.4.22: Flags [.], ack 38792, win 8201, length 0
20:28:45.734429 IP 10.1.0.4.22 > 72.255.0.160.6965: Flags [P.], seq 39280:39524, ack 3025, win 1251, length 244
20:28:45.829274 IP 72.255.0.160.6965 > 10.1.0.4.22: Flags [.], ack 39036, win 8207, length 0
20:28:45.838406 IP 10.1.0.4.22 > 72.255.0.160.6965: Flags [P.], seq 39524:39768, ack 3025, win 1251, length 244
20:28:45.922935 IP 72.255.0.160.6965 > 10.1.0.4.22: Flags [.], ack 39280, win 8206, length 0
20:28:45.942525 IP 10.1.0.4.22 > 72.255.0.160.6965: Flags [P.], seq 39768:40012, ack 3025, win 1251, length 244
20:28:46.029690 IP 72.255.0.160.6965 > 10.1.0.4.22: Flags [.], ack 39524, win 8205, length 0
20:28:46.046402 IP 10.1.0.4.22 > 72.255.0.160.6965: Flags [P.], seq 40012:40256, ack 3025, win 1251, length 244
20:28:46.138791 IP 72.255.0.160.6965 > 10.1.0.4.22: Flags [.], ack 39768, win 8204, length 0
20:28:46.150489 IP 10.1.0.4.22 > 72.255.0.160.6965: Flags [P.], seq 40256:40500, ack 3025, win 1251, length 244
20:28:46.197523 IP 10.1.0.4.40282 > 168.63.129.16.80: Flags [S], seq 542153782, win 64240, options [mss 1460,sackOK,TS val 3258006658 ecr 0,nop,wscale 7], length 0
20:28:46.198796 IP 168.63.129.16.80 > 10.1.0.4.40282: Flags [S.], seq 1083688678, ack 542153783, win 65535, options [mss 1460,nop,wscale 8,sackOK,TS val 88917506 ecr 3258006658], length 0
20:28:46.198831 IP 10.1.0.4.40282 > 168.63.129.16.80: Flags [.], ack 1, win 502, options [nop,nop,TS val 3258006659 ecr 88917506], length 0
20:28:46.198886 IP 10.1.0.4.40282 > 168.63.129.16.80: Flags [P.], seq 1:201, ack 1, win 502, options [nop,nop,TS val 3258006659 ecr 88917506], length 200: HTTP: GET /machine/?comp=goalstate HTTP/1.1
20:28:46.202289 IP 168.63.129.16.80 > 10.1.0.4.40282: Flags [FP.], seq 1:2281, ack 201, win 16387, options [nop,nop,TS val 88917510 ecr 3258006659], length 2280: HTTP: HTTP/1.1 200 OK
20:28:46.202320 IP 10.1.0.4.40282 > 168.63.129.16.80: Flags [.], ack 2282, win 537, options [nop,nop,TS val 3258006663 ecr 88917510], length 0
20:28:46.202603 IP 10.1.0.4.40282 > 168.63.129.16.80: Flags [F.], seq 201, ack 2282, win 537, options [nop,nop,TS val 3258006663 ecr 88917510], length 0
20:28:46.202932 IP 168.63.129.16.80 > 10.1.0.4.40282: Flags [.], ack 202, win 16387, options [nop,nop,TS val 88917510 ecr 3258006663], length 0
20:28:46.203409 IP 10.1.0.4.38690 > 168.63.129.16.32526: Flags [S], seq 1459014686, win 64240, options [mss 1460,sackOK,TS val 3258006664 ecr 0,nop,wscale 7], length 0
20:28:46.204094 IP 168.63.129.16.32526 > 10.1.0.4.38690: Flags [S.], seq 641744153, ack 1459014687, win 65535, options [mss 1460,nop,wscale 8,sackOK,TS val 88917511 ecr 3258006664], length 0
20:28:46.204118 IP 10.1.0.4.38690 > 168.63.129.16.32526: Flags [.], ack 1, win 502, options [nop,nop,TS val 3258006665 ecr 88917511], length 0
20:28:46.204180 IP 10.1.0.4.38690 > 168.63.129.16.32526: Flags [P.], seq 1:441, ack 1, win 502, options [nop,nop,TS val 3258006665 ecr 88917511], length 440
20:28:46.210715 IP 168.63.129.16.32526 > 10.1.0.4.38690: Flags [FP.], seq 1:146, ack 441, win 16386, options [nop,nop,TS val 88917518 ecr 3258006665], length 145
20:28:46.211030 IP 10.1.0.4.38690 > 168.63.129.16.32526: Flags [F.], seq 441, ack 147, win 501, options [nop,nop,TS val 3258006671 ecr 88917518], length 0
20:28:46.211434 IP 168.63.129.16.32526 > 10.1.0.4.38690: Flags [.], ack 442, win 16386, options [nop,nop,TS val 88917519 ecr 3258006671], length 0
20:28:46.211654 IP 10.1.0.4.38706 > 168.63.129.16.32526: Flags [S], seq 3417927650, win 64240, options [mss 1460,sackOK,TS val 3258006672 ecr 0,nop,wscale 7], length 0
20:28:46.212328 IP 168.63.129.16.32526 > 10.1.0.4.38706: Flags [S.], seq 210874177, ack 3417927651, win 65535, options [mss 1460,nop,wscale 8,sackOK,TS val 88917520 ecr 3258006672], length 0
20:28:46.212350 IP 10.1.0.4.38706 > 168.63.129.16.32526: Flags [.], ack 1, win 502, options [nop,nop,TS val 3258006673 ecr 88917520], length 0
20:28:46.212388 IP 10.1.0.4.38706 > 168.63.129.16.32526: Flags [P.], seq 1:389, ack 1, win 502, options [nop,nop,TS val 3258006673 ecr 88917520], length 388
20:28:46.212405 IP 10.1.0.4.38706 > 168.63.129.16.32526: Flags [P.], seq 389:961, ack 1, win 502, options [nop,nop,TS val 3258006673 ecr 88917520], length 572
20:28:46.212599 IP 168.63.129.16.32526 > 10.1.0.4.38706: Flags [.], ack 961, win 16384, options [nop,nop,TS val 88917520 ecr 3258006673], length 0
20:28:46.215629 IP 168.63.129.16.32526 > 10.1.0.4.38706: Flags [FP.], seq 1:155, ack 961, win 16384, options [nop,nop,TS val 88917523 ecr 3258006673], length 154
20:28:46.216131 IP 10.1.0.4.38714 > 168.63.129.16.32526: Flags [S], seq 431149142, win 64240, options [mss 1460,sackOK,TS val 3258006677 ecr 0,nop,wscale 7], length 0
20:28:46.216732 IP 168.63.129.16.32526 > 10.1.0.4.38714: Flags [S.], seq 2548794340, ack 431149143, win 65535, options [mss 1460,nop,wscale 8,sackOK,TS val 88917524 ecr 3258006677], length 0
20:28:46.216771 IP 10.1.0.4.38714 > 168.63.129.16.32526: Flags [.], ack 1, win 502, options [nop,nop,TS val 3258006677 ecr 88917524], length 0
20:28:46.216808 IP 10.1.0.4.38714 > 168.63.129.16.32526: Flags [P.], seq 1:390, ack 1, win 502, options [nop,nop,TS val 3258006677 ecr 88917524], length 389
20:28:46.216841 IP 10.1.0.4.38714 > 168.63.129.16.32526: Flags [P.], seq 390:2351, ack 1, win 502, options [nop,nop,TS val 3258006677 ecr 88917524], length 1961
20:28:46.217110 IP 168.63.129.16.32526 > 10.1.0.4.38714: Flags [.], ack 2351, win 16388, options [nop,nop,TS val 88917525 ecr 3258006677], length 0
20:28:46.220038 IP 168.63.129.16.32526 > 10.1.0.4.38714: Flags [FP.], seq 1:155, ack 2351, win 16388, options [nop,nop,TS val 88917528 ecr 3258006677], length 154
20:28:46.220369 IP 10.1.0.4.38706 > 168.63.129.16.32526: Flags [F.], seq 961, ack 156, win 501, options [nop,nop,TS val 3258006681 ecr 88917523], length 0
20:28:46.220407 IP 10.1.0.4.38714 > 168.63.129.16.32526: Flags [F.], seq 2351, ack 156, win 501, options [nop,nop,TS val 3258006681 ecr 88917528], length 0
20:28:46.220593 IP 168.63.129.16.32526 > 10.1.0.4.38706: Flags [.], ack 962, win 16384, options [nop,nop,TS val 88917528 ecr 3258006681], length 0
20:28:46.220703 IP 168.63.129.16.32526 > 10.1.0.4.38714: Flags [.], ack 2352, win 16388, options [nop,nop,TS val 88917528 ecr 3258006681], length 0
20:28:46.247578 IP 72.255.0.160.6965 > 10.1.0.4.22: Flags [.], ack 40012, win 8203, length 0
20:28:46.254881 IP 10.1.0.4.22 > 72.255.0.160.6965: Flags [P.], seq 40500:43324, ack 3025, win 1251, length 2824
20:28:46.254894 IP 10.1.0.4.22 > 72.255.0.160.6965: Flags [P.], seq 43324:44632, ack 3025, win 1251, length 1308
20:28:46.255771 IP 10.1.0.4.22 > 72.255.0.160.6965: Flags [P.], seq 44632:46116, ack 3025, win 1251, length 1484
20:28:46.340052 IP 72.255.0.160.6965 > 10.1.0.4.22: Flags [.], ack 40256, win 8202, length 0
20:28:46.358460 IP 10.1.0.4.22 > 72.255.0.160.6965: Flags [P.], seq 46116:46264, ack 3025, win 1251, length 148
20:28:46.358642 IP 10.1.0.4.22 > 72.255.0.160.6965: Flags [P.], seq 46264:46628, ack 3025, win 1251, length 364
20:28:46.447769 IP 72.255.0.160.6965 > 10.1.0.4.22: Flags [.], ack 40500, win 8207, length 0
20:28:46.462403 IP 10.1.0.4.22 > 72.255.0.160.6965: Flags [P.], seq 46628:46984, ack 3025, win 1251, length 356
20:28:46.507781 IP 72.255.0.160.6965 > 10.1.0.4.22: Flags [.], ack 43324, win 8207, length 0
20:28:46.507781 IP 72.255.0.160.6965 > 10.1.0.4.22: Flags [.], ack 46116, win 8207, length 0
20:28:46.566481 IP 10.1.0.4.22 > 72.255.0.160.6965: Flags [P.], seq 46984:47324, ack 3025, win 1251, length 340
20:28:46.610733 IP 72.255.0.160.6965 > 10.1.0.4.22: Flags [.], ack 46628, win 8205, length 0
20:28:46.670422 IP 10.1.0.4.22 > 72.255.0.160.6965: Flags [P.], seq 47324:47568, ack 3025, win 1251, length 244
20:28:46.670936 IP 10.1.0.4.22 > 72.255.0.160.6965: Flags [P.], seq 47568:47604, ack 3025, win 1251, length 36
20:28:46.755538 IP 72.255.0.160.6965 > 10.1.0.4.22: Flags [.], ack 46984, win 8203, length 0
20:28:46.774523 IP 10.1.0.4.22 > 72.255.0.160.6965: Flags [P.], seq 47604:47752, ack 3025, win 1251, length 148
20:28:46.774558 IP 10.1.0.4.22 > 72.255.0.160.6965: Flags [P.], seq 47752:47996, ack 3025, win 1251, length 244
20:28:46.863872 IP 72.255.0.160.6965 > 10.1.0.4.22: Flags [.], ack 47324, win 8202, length 0
20:28:46.878435 IP 10.1.0.4.22 > 72.255.0.160.6965: Flags [P.], seq 47996:48352, ack 3025, win 1251, length 356
20:28:46.922943 IP 72.255.0.160.6965 > 10.1.0.4.22: Flags [.], ack 47604, win 8207, length 0
20:28:46.982430 IP 10.1.0.4.22 > 72.255.0.160.6965: Flags [P.], seq 48352:48596, ack 3025, win 1251, length 244
20:28:47.026538 IP 72.255.0.160.6965 > 10.1.0.4.22: Flags [.], ack 47996, win 8205, length 0
20:28:47.086434 IP 10.1.0.4.22 > 72.255.0.160.6965: Flags [P.], seq 48596:48840, ack 3025, win 1251, length 244
20:28:47.173090 IP 72.255.0.160.6965 > 10.1.0.4.22: Flags [.], ack 48352, win 8204, length 0
20:28:47.190415 IP 10.1.0.4.22 > 72.255.0.160.6965: Flags [P.], seq 48840:49084, ack 3025, win 1251, length 244
20:28:47.279549 IP 72.255.0.160.6965 > 10.1.0.4.22: Flags [.], ack 48596, win 8203, length 0
20:28:47.294393 IP 10.1.0.4.22 > 72.255.0.160.6965: Flags [P.], seq 49084:49328, ack 3025, win 1251, length 244
20:28:47.385374 IP 72.255.0.160.6965 > 10.1.0.4.22: Flags [.], ack 48840, win 8202, length 0
20:28:47.398393 IP 10.1.0.4.22 > 72.255.0.160.6965: Flags [P.], seq 49328:49572, ack 3025, win 1251, length 244
20:28:47.493342 IP 72.255.0.160.6965 > 10.1.0.4.22: Flags [.], ack 49084, win 8207, length 0
20:28:47.502373 IP 10.1.0.4.22 > 72.255.0.160.6965: Flags [P.], seq 49572:49816, ack 3025, win 1251, length 244
20:28:47.600199 IP 72.255.0.160.6965 > 10.1.0.4.22: Flags [.], ack 49328, win 8206, length 0
20:28:47.606400 IP 10.1.0.4.22 > 72.255.0.160.6965: Flags [P.], seq 49816:50060, ack 3025, win 1251, length 244
20:28:47.693255 IP 72.255.0.160.6965 > 10.1.0.4.22: Flags [.], ack 49572, win 8205, length 0
20:28:47.710438 IP 10.1.0.4.22 > 72.255.0.160.6965: Flags [P.], seq 50060:50304, ack 3025, win 1251, length 244
20:28:47.801979 IP 72.255.0.160.6965 > 10.1.0.4.22: Flags [.], ack 49816, win 8204, length 0
20:28:47.814428 IP 10.1.0.4.22 > 72.255.0.160.6965: Flags [P.], seq 50304:50548, ack 3025, win 1251, length 244
20:28:47.909473 IP 72.255.0.160.6965 > 10.1.0.4.22: Flags [.], ack 50060, win 8203, length 0
20:28:47.918665 IP 10.1.0.4.22 > 72.255.0.160.6965: Flags [P.], seq 50548:50792, ack 3025, win 1251, length 244
20:28:48.002713 IP 72.255.0.160.6965 > 10.1.0.4.22: Flags [.], ack 50304, win 8202, length 0
^Z
[7]+  Stopped                 sudo tcpdump -n -i eth0
harry@lamp-server:~$